18452230, Tasty Adda, Error Code = 404,,,,,,,,
23575, Aisha Fast Food Centre,Aisha Fast Food Centre, North Indian, Chinese, Fast Food,,,,,
18198669, Nu Sagar,Nu Sagar, Biryani,,,,,,,
18420387, Ramanas, Error Code = 404,,,,,,,,
18354226, Exotic Eats,Exotic Eats, Continental, North Indian, Chinese,,,,,
23681, Lalti Food Centre,Lalti Food Centre, North Indian, Mughlai, Chinese,,,,,
18143238, Ghosh & Co.,Ghosh & Co., Mishti,,,,,,,
25554, RR Kaizen,RR Kaizen, Bengali, Fast Food,,,,,,
25226, Albela Biriyani, Error Code = 404,,,,,,,,
25419, Anapurna,Anapurna, Mishti,,,,,,,
18386806, China Valley - Golden Parkk, Error Code = 404,,,,,,,,
18386798, Park Sweets,Park Sweets, Mishti,,,,,,,
18217476, Silver Nest,Silver Nest, North Indian,,,,,,,
18377075, Lokenath Sweet & Snacks,Lokenath Sweet & Snacks, Chinese, Mughlai, Fast Food, Momos,,,,
18237050, Annapurna Sweets,Annapurna Sweets, Mishti,,,,,,,
22379, Paprika,Paprika, Continental, Italian, Thai,,,,,
18259436, Sreelagna,Sreelagna, Fast Food,,,,,,,
23129, Relish,Relish, Gujarati,,,,,,,
25568, Cafe Valentino,Cafe Valentino, Italian, South Indian,,,,,,
22151, Royal Food Valley,Royal Food Valley, Chinese, Street Food,,,,,,
22845, Food Zone,Food Zone, North Indian, Chinese,,,,,,
24618, New Mezban,New Mezban, Biryani,,,,,,,
23584, Haji Malang,Haji Malang, North Indian, Biryani, Mughlai,,,,,
22023, Matri Hotel & Restaurant,Matri Hotel & Restaurant, Fast Food,,,,,,,
25160, Hot N Fresh, Error Code = 404,,,,,,,,
18354608, Ice Queen Parlour, Error Code = 404,,,,,,,,
23217, New Bawarchi, Error Code = 404,,,,,,,,
18354073, Go Grillzz,Go Grillzz, Italian, Chinese, Bengali,,,,,
18296325, The Quick Bite, Error Code = 404,,,,,,,,
18162650, Brick Bakers,Brick Bakers, Desserts, Bakery,,,,,,
21852, Yummee,Yummee, Street Food, Chinese,,,,,,
25669, Bhog Box, Error Code = 404,,,,,,,,
18431485, The Sizzle,The Sizzle, Chinese, Momos,,,,,,
18420363, Ma Kali Mistanna Bhander,Ma Kali Mistanna Bhander, Mishti,,,,,,,
18431442, The Floresta Restaurant,The Floresta Restaurant, Chinese, Mughlai,,,,,,
22922, CH Gope Sweets,CH Gope Sweets, Street Food, Mishti,,,,,,
18166905, Zam Zam,Zam Zam, Mughlai, Biryani,,,,,,
18249159, Cafe B.I.U., Error Code = 404,,,,,,,,
18232754, Radhuni Home Delivery, Error Code = 404,,,,,,,,
18440241, Pepperz, Error Code = 404,,,,,,,,
18447690, Adiram's,Adiram's, Bakery, Mishti,,,,,,
21024, Just Baked,Just Baked, Bakery, Fast Food, Desserts,,,,,
24871, Cafe Bollywood, Error Code = 404,,,,,,,,
22171, Diamond Food,Diamond Food, North Indian, Chinese,,,,,,
18296360, Hotel Minerva,Hotel Minerva, North Indian, Chinese, Finger Food,,,,,
22909, Gupta Hotel,Gupta Hotel, North Indian,,,,,,,
22891, Amantran Family Restaurant,Amantran Family Restaurant, Chinese,,,,,,,
18311158, Zero Miles,Zero Miles, North Indian, Chinese,,,,,,
23524, Mahamaya Mistanna Bhandar,Mahamaya Mistanna Bhandar, Mishti,,,,,,,
25567, Food Zone - Hotel Shivangan & Banquets, Error Code = 404,,,,,,,,
25695, Sugar Palette, Error Code = 404,,,,,,,,
22957, Thakur Dhaba, Error Code = 404,,,,,,,,
17983795, Bedwin - Food Plaza,Bedwin, Chinese, North Indian,,,,,,
22851, New Star Haji Biryani,New Star Haji Biryani, North Indian, Street Food,,,,,,
22205, Drop In,Drop In, North Indian, Chinese,,,,,,
21969, Suruchi,Suruchi, North Indian, Chinese,,,,,,
18296321, Goli Vada Pav, Error Code = 404,,,,,,,,
23738, Punjabi Snacks Bar,Punjabi Snacks Bar, Fast Food, Beverages,,,,,,
25671, Khalsa Hotel,Khalsa Hotel, North Indian,,,,,,,
22847, Vojon Restaurant, Error Code = 404,,,,,,,,
18452235, Mr. Wrappee,Mr. Wrappee, Fast Food, Ice Cream, Momos,,,,,
24602, Veg Foodiezz Cafeteria, Error Code = 404,,,,,,,,
18134900, Dwarka Mistana Bhandar,Dwarka Mistanna Bhander, Mishti,,,,,,,
18237041, Annapurna Sweets,Annapurna Sweets, Mishti,,,,,,,
25070, Rubai's Kitchen,Rubai's Kitchen, North Indian, Chinese,,,,,,
18200597, Khabar - The Eatery,Khabar - The Eatery, Chinese, North Indian,,,,,,
24123, Xebra - The Sports Lounge,Xebra - The Sports Lounge, Finger Food,,,,,,,
20762, Pooja Snacks, Error Code = 404,,,,,,,,
23412, Spice O Life,Spice O Life, North Indian, Chinese, Bengali,,,,,
24580, Euphoria - Hotel Senses, Error Code = 404,,,,,,,,
18287230, Kandy Crush, Error Code = 404,,,,,,,,
24886, The Last Course,The Last Course, Bakery, Desserts,,,,,,
18198690, Kamat Cafe, Error Code = 404,,,,,,,,
18236290, Piyali Restaurant,Piyali Restaurant, North Indian, Bengali,,,,,,
18398864, Flavours,Flavours, Fast Food, Chinese,,,,,,
24257, North & South Indian,North & South Indian, North Indian, South Indian,,,,,,
